reviewId,rating,date,option,skinType,skinTone,helpfulCount,hasPhoto,isRepurchase,content
28255228,5,"2024.05.18","쑥떡팩폼 120ml+15ml 추가증정","A03","B04",0,true,false,"질감이 진짜 떡같아요! 쫀득한 반죽느낌 그리고 어린쑥 라인 제품보다 좀 더 진한 쑥, 풀의 향이 나요 브러쉬 받고 싶어서 택배로 시켰다고 생각했는데 없어서 보니까 오늘드림으로 주문했더라구요 기특하다 나 정말ㅎ 맘에 들면 재구매하고 브러쉬도 받겟습니다•••"
28217880,5,"2024.05.17","쑥떡팩폼 120ml+15ml 추가증정","A07","B03",1,true,false,"여름이 다가오는데 피지걱정에 사봤어요 그냥 워시오프팩은 너무 귀찮아서ㅠㅠ안해지길래 얘는 바르고 바로 폼클렌저로 쓰면돼서 너무 편해요 거품도 엄청 잘나고 쑥이다보니 진정효과도 있고 좋더라구요! 제가 쑥떡도 극혐하는 쑥헤이런데 향이 역하진않을까 약간 걱정했믄데 쑥향이 올라오긴하는데 풀숲향베이스라서 그래도 갠츈해요!!!"
28217077,5,"2024.05.17","쑥떡팩폼 120ml+15ml 추가증정","A03","B02",1,true,true,"어린쑥팩이 오특에서 할인행사를 해서 얼른 집어왔어요 다른 폼클렌징보다는 가격이 좀 있어서 팩으로 사용해야지 했었는데 득템했네요 폼클렌징으로 잘 사용하고 있고 거품도 잘 나고 세안하고 나서 얼굴이 굉장히 당겨서 항상 세안하고 나면 바로 스킨챱챱 뿌리고 흡수시켰었는데 그렇게 당기지 않아서 좋아요 모공노폐물 제거는 잘 되는거 같은데 다른 폼보다 더 좋다 이런것 까지는 아니지만 모공 노폐물제거는 잘 되는거 같아요 꾸준히 사용해봐야 알 것 같아요"
28188369,5,"2024.05.15","쑥떡팩폼 120ml+15ml 추가증정","A03","B04",1,true,true,"쑥떡이라는 이름 답게 정말 쑥떡이 연상되는 향긋한 쑥향과, 쫀득한 녹색 제형! 정말 이 쫀쫀한 제형으로 피부에 과잉피지나 각질들을 잘 잡아낼 수 있을 것 같음! 구성도 15ml 휴대용에 시원하게 모공 청소할 수 있는 모공브러시까지 줌! 처음에 신상품으로 나왔을 때 궁금해서 샀을 땐 이런 거 없었는데 역시 신상품은 아무리 궁금해도 조금만 참았다가 사는 게 맞는 것 같음😂   쫀득한 사용감이어서 수분을 다 뺏어가는 강한 제품이면 어쩌지 생각했는데 마냥 알칼리폼이 아닌 살리실산이 들어가 있어서 여드름이나 피지케어에도 좋고, 생각보다 자극적이지 않아서 마음에 들었다"
28117961,5,"2024.05.13","쑥떡팩폼 120ml+15ml 추가증정","","",1,true,false,"쑥이 들어간 폼 클렌징은 처음인데 거품도 쫀쫀하고 쑥 같은 성분이 눈에 보여서 신기하네요. 큰 자극 없이 세안이 잘 되는 편인데 사용 후에 약간 피부 뽀득거림이 있어요. 피부가 건조하거나 그렇진 않습니다. 앞으로 꾸준히 사용해봐야겠어요 감사합니다"
28102948,5,"2024.05.12","쑥떡팩폼 120ml+15ml 추가증정","A01","B02",0,true,false,"와 너무 좋아요. 제 인생템 등극입니다. 지성피부 + 화이트헤드 보유하신 분들? 무조건 사세요. 이 제품은 팩처럼 쓸수도 있고 폼으로도 쓸 수 있어서 좋네요. 게다가 팩처럼 하고나면 화이트헤드가 사라져있어요. 진심 대박... 너무 마음에 들어요. 재구매 의사율 10000% 입니다"
28094340,5,"2024.05.12","쑥떡팩폼 120ml+15ml 추가증정","A04","B02",0,true,false,"클렌징흡착폼이라니 너무 획기적인 제품 같아요 쪽득쫀득한 제형이 피부에 달라 붙어 팩으로 활용하면 좋을 것 같은데 클렌징이라는 이중효과를 볼 수 있어 더 좋네요~~ 전 클렌징으로만 사용하기엔 아까워서 팩으로 활용하려고 해요... 같이 보내준 브러시로 팩바르고 1~2분 후에 문질문질 해주고 씻어내려갈 때 풍성한 거품이 속까지 시원하게하네요~ 겨울동안 꼭꼭 숨어왔던 피지들이 쏙 빠질 것 같지만....첫 술에 배부르랴 ㅎㅎ 한율 스킨에센스도 너무 잘 사용하고 있는데 요 팩을 하고 스킨에센스로 톡톡 두드려주면 피부보습과 피지관리 올 한해는 요것으로 관리 해주기로 했답니다~~"
28078203,5,"2024.05.11","쑥떡팩폼 120ml+15ml 추가증정","A04","B01",0,true,false,"피지 고민있으신 분들 제발 팩 따로 하지마시고 이거 사용하세요. 🙏🏻🙏🏻 진심을 다해 추천 드립니다  제가 코랑 이마가 정말 피지 부자인데요  정말 자극 하나도 없이 피지랑 기름 제거는 물론이고  피부결 정돈까지 해줍니다.  원래는 오일 사용했었는데 피부가 예민해서 트러블 올라오고 폼으로 이중세안 해야 그나마 피부가 좀 산뜻했었는데, 이건 팩폼 하나만 사용해도 기름 제거 효과 만점입니다. 그리고 확실히 오일보다 사용 후에 덜 건조해요.  세안 후 블랙헤드들 +피지덩어리들 사라진 것도 바로 눈에 보이고 만족만족 🥹🥹♥️♥️ 그리고 팩폼 브러시도 정말 너무 좋아서 감격했는데요  다른 세안용 칫솔 브러시는 너무 딱딱해서 피부가 붉어졌는데, 이건 힘 하나도 안들어고 말캉해서 정말 너무 좋아요. 죽을때까지 이 제품만 사용할 듯합니다  사라지지마세요🙏🏻😭"
28062277,4,"2024.05.11","쑥떡팩폼 120ml+15ml 추가증정","A04","",0,true,false,"피지 조절에 좋다고 해서 구매해봤습니다. 피부가 민감성이라 예민해서 코와 볼 위주만 사용해 봤습니다. 확실히 쑥 특유의 향이 나는 듯 하여 흥미로 웠고 사용 직후 세안을 하면 알칼리성 특유의 쫀쫀한 피부 세안이 가능합니다. 1주에 2~3번 사용하려 피지 조절에 좋을 듯 합니다"
28054499,5,"2024.05.10","쑥떡팩폼 120ml+15ml 추가증정","A02","B04",0,true,false,"일단 질감은 찐뜩찐득한 젤리 같아요 근데 물이 살짝 뭍으면 거품도 잘나고 세정에 좋은거같아요 저는 폼보다는 세미팩 같이 쓰는게 나을거같아요 저는 건성이라 보통 이렇게 찐득한 폼은 하고 나서 땡기는데 하고 나서도 안땡겨서 좋아요 일주일 두번 주기적으로 하면 좋을거같아요"
28029874,5,"2024.05.09","쑥떡팩폼 120ml+15ml 추가증정","","",0,true,false,"데일리 클린징 팩 폼이예요. 얼굴에 도포 후 1,2분 가량 롤링 후 미온수를 세안하니.. 풍성한 거품으로 세정력이 정말 좋구나 라는 생각이 들었어요. 팩기능까지 더해서 촉촉한 피부를 더해 주었는데.. 아마도 팩기능 덕분인듯.   깨끗한 세정과 팩을 동시에.. 매일매일 한다니.. 대박상품인듯요.."
28026189,5,"2024.05.09","쑥떡팩폼 120ml+15ml 추가증정","A04","B03",0,true,false,"이름이 찰떡이네요. 피지흡착 쑥떡팩폼!! 뭔가 쫀득할 것 같은 이름인데 역시나 피부에 촥붙어요. 피지도 쑥쑥 같이 잘 빠지는 느낌입니다. 그런데도 사용후 건조하지가 않아요!! 폼클렌징으로 사용해도 좋은데 한번씩 팩으로 해주면 묶은 각질이 사라지는 것 같아요."
28026012,5,"2024.05.09","쑥떡팩폼 120ml+15ml 추가증정","A03","B02",0,true,false,"제형 자체가 아주 쫀득하고 쑥향이 향긋해요. 아무래도 팩으로 쓸 때 세정력이 좀더 있는 편이고 폼으로 써도 좋아요. 피지제거용이다보니 세안 후 촉촉하기보단 뽀득뽀득한데 금방 기초 발라주니 상관없어요. 조금만 짜도 거품도 많이나고 세안 후 피부가 깔끔하네요~ 샘플이랑 브러쉬도 더 보내주셔서 감사합니다☺️ 잘 쓸게요💕"
28018858,5,"2024.05.09","쑥떡팩폼 120ml+15ml 추가증정","A03","B02",8,true,false,"팩처럼 올려봤더니 콧망울이 뽀독하게 깨끗해졌어요. 유분 쏙 빠짐. 딱히 자극은 없고요. 롤링 살살 하기  블랙헤드는 없어서 모르겠는데 제거 잘 된다니 흠 킵해두고 싶은..  세정력 좋아요. 요즘은 약산성 강조하는 세안제가 많아서 역으로 새롭네요.  여름에 개운하게 씻고 싶을 날 가끔 써주면 좋을 것 같아요"
27965400,5,"2024.05.07","쑥떡팩폼 120ml+15ml 추가증정","A03","B02",0,true,false,"약산성클렌저만 봤지 약알칼리는 생소해서 궁금했어요.  손등에 짰는데 비주얼이ㅋㅋㅋ 쫀득하고 질감이 재밌어요 클렌징워터로 선크림닦고 물로 헹군 후 물기 닦은 다음에 얼굴에 쑥떡폼 도포한 상태로 몸샤워 한 후 물묻혀서 롤링하고 닦아냈습니다. 사용 직후 촉촉한 느낌이 확 들었고 얼굴이 맨들맨들.. 요즘 피곤해서 피부 광이 안났는데 광이 확 돌아요! 저녁사용허고 아침에도 광이 남아있었어요ㅎㅎ 저는 향도 좋고 만족합니다. 한율꺼 쌀도 밤도 쑥도 다 좋네여ㅎㅎ 한율 내스타일입니댜"
27957573,5,"2024.05.06","쑥떡팩폼 120ml+15ml 추가증정","A03","B05",1,true,false,"약간 재질이 뻑뻑한 느낌인지 알았는데 시간이 지나니 거품처럼 바뀌네요 진득하 것이 청소를 해주는지 세안하고 나서는 바로 하얘지는 느낌입니다 저같은 지성이나 복합성한테는 딱인거같습니다 특히 피지가 많이 올라오는 때 하면 좋을거같습니다"
27955897,5,"2024.05.06","쑥떡팩폼 120ml+15ml 추가증정","A03","B03",1,true,false,"수부지 피부라 촉촉한 약알칼리성 클렌징폼을 찾다가 한율에서 새로나온 제품이길래 구매했어요. 약알칼리성 클렌징은 세정력이 늘 아쉬웠눈데 이 제품은 뽀득뽀득하고 촉촉합니다. 100% 국내산 쑥을 사용하여 쑥향 가득하고 쫀쫀한 텍스쳐에요. 너무 마음에 듭니다!"
27954100,5,"2024.05.06","쑥떡팩폼 120ml+15ml 추가증정","A03","B02",4,true,false,"자극없이 피지제거에 좋은 클렌징폼! 요즘 날씨도 더워지니깐 피지분비도 자연스레 증가하더라고요 그러던 참에 피지흡착되는 클레이팩이나 알칼리팩 찾는제 한율에서 딱 필요한 신제품을 만들었기에 바로 사봤습니다 일단 진짜 쑥향이나는데 떡처럼 쫀득쫀득한 제형으로 맨손으로는 바르기엔 그 떡같은 느낌이라 조금 어려웠지만 쫀쫀함을 느낄 수 있었고 피지도 쫙달라붙게다는 생각이들었습니다 또한 거품도 쫀쫀한상태여서 세정력이 좋다는 생각이들었고 세수 후에 피지가 싹 걷힌듯 기름기가 없고 뽀득뽀득한 피부를 만날 수 있었습니다 덕분에 이 여름철에 필요한 제품을 잘 찾은것같네요"
27935437,5,"2024.05.06","쑥떡팩폼 120ml+15ml 추가증정","A01","B02",0,true,false,"어제 처음에는 팩으로 해봤는데 피부에 뭐가 나있어서 조금 쎄게 다가왔네요🫢 오늘 아침에 다시 폼으로 세안을 했더니 괜찮았어요!! 피부에 뭐가 나있거나 하면 바로 팩하지 마시고 클렌징용으로 하면서 피부가 가라앉으면 그때 팩으로 하는게 좋을거 같아요 😎  확실히 피부에 있는 기름기를 쫙 빨아먹은것처럼 피부가 담백해진느낌 입니다 🤣  쫀쫀해진 느낌이라 아주 만족해요🌱"
27927309,5,"2024.05.05","쑥떡팩폼 120ml+15ml 추가증정","","",0,true,true,"저번에 사고 만족하면서 쓰고 있어서 이번에 또 재구매했습니당~ 일단 저번보다 할인하고 사은품까지 받아서 넘넘 좋았어요~~ 이 제품은 기존에 사용해오던 클렌징폼이랑은 좀 다르게 바로 세안하지않고 기다렸다가 세안하다보니 조금 더 뭔가 깨끗하게 세안하는 느낌..?이 들더라구요:) 그렇다고 피부에 자극되는 느낌이 드는 것도 아니라서 만족하면서 사용하고 있어요^_^"
27925810,5,"2024.05.05","쑥떡팩폼 120ml+15ml 추가증정","A04","",0,true,false,"한율 클렌징 흡착 팩폼이 새로 나왔다해서 구매해봤어요. 지성피부라 약산성보다는 약알칼리성 클렌저가 더 잘 맞더라구요~ 진짜 쑥떡처럼 쫀쫀해서 팩폼으로 딱이네요 ! 확실히 기름이 잘 제거되고 피지 관리에도 좋아요. 같이 준 브러쉬로 도포하고 클렌징까지 하니 더 좋구,, 품절 전 구매하길 잘했다아 🌿"
27920934,5,"2024.05.05","쑥떡팩폼 120ml+15ml 추가증정","A02","B04",0,true,true,"사용해봤는데 좋아서 재구매했음 이거 출시하자마자 브랜드믿고 구매란거라 후기도별로 없어서 그냥 얼마나 발라야하는지 고민래보다가 많이도 발라보고 적당히도 발라봤는데 손가락 한-두마디정도 양이면 충분한듯 시간도 오래 안걸리고 아침에 얼굴이 맨들해짐"
27911759,5,"2024.05.05","쑥떡팩폼 120ml+15ml 추가증정","A02","B01",0,true,false,"피부에 각질제거, 강한 세정이 되는 제품은 잘 사용하지않을 정도로 민감성 피부입니다 그래도 여름은 더워지니 모공ㅇ 열리고 유분이 생겨서 고민하다가 순해보이는 한율 제품 구매했어요! 브러쉬를 주셔서 더 꼼꼼하고 자극없이 사용할수있을거같아요! 히알루론산이 들어있다고 해서 그런지 씻고나서 피부가 속당김도 없고 보습이 같이 채워지는 기분이에요!!"
27910731,5,"2024.05.05","쑥떡팩폼 120ml+15ml 추가증정","A03","",0,true,false,"저는 클렌징 팩으로 쓰려고 샀습니다! 피부에 자극없이 피지 흡착이 되는거 같아 만족스럽습니다! 향은 어린쑥미스트랑 동일해서 너무 좋아요ㅠ 팩처럼 올려놓고 머리감고 살살 롤링하며 씻어내면 딱 좋았습니다! 사용 후 피부가 당기거나 건조하지도 않아 좋았습니다!"
27908840,5,"2024.05.05","쑥떡팩폼 120ml+15ml 추가증정","","",0,true,false,"피지와 여드름이 많은 초초초 지성피부입니다. 어린쑥 라인은 시카크림, 팩, 디퓨저를 사용해보았는데 클렌징팩폼도 향기가 너무 좋아요~ 데일리 폼으로 사용하고 주 1회 정도 팩하면 딱 좋겠어요!  같이 보내주신 브러쉬도 감사합니다^_^"
27907735,5,"2024.05.05","쑥떡팩폼 120ml+15ml 추가증정","A04","B05",0,true,false,"요 근래 썼던 화장품 중 가장 만족감이 높았던 제품이에요. 한 가지 제품에 팩도 할 수 있고 클렌징도 할 수 있고 스크럽도 할 수 있는 제품이라 너무 마음에 들었습니다. 시카(진정) 라인이 저랑 잘 맞는 것도 있겠지만 피부 컨디션에 따라 활용성이 높아 너무나 만족합니다. 쑥 향이 일단 진해서 스파나 목욕탕이 온 것 같은 느낌이 들고 질감이 쫀쫀해서 피부에 잘 붙어요. 물을 묻히면서 롤링하면 쫀쫀한 질감 때문에 스크럽도 되고 미세먼지나 블랙헤드도 달라붙어서 클렌징이 확실히 잘됩니다. 물을 묻히고 처음 헹굴 때 피부가 매끈거리는 게 느껴지고 세안을 다 하고 나면 피부에 있던 각질이나 노폐물이 다 없어진 기분이 들어요. 그날 피부 컨디션에 따라서 팩이나 클렌징으로 내가 하고 싶은 대로 할 수 있어서 너무 좋습니다. 잘 구매했다는 생각이 들고 100% 재구매 의사 있습니다. 다만 아쉬운 점은 가격 대비 용량이 120ml라 아쉽네요. 시중에 나온 폼클렌징들은 평균 150이나 200ml인데 좀 더 용량이 컸으면 좋겠어요."
27900728,5,"2024.05.04","쑥떡팩폼 120ml+15ml 추가증정","","",2,true,false,"한율 어린쑥라인은 수분크림을 잘 사용한 기억이 있어서 기대하면서 사용해봤어요!  팩처럼 얹어놨다가 시간 좀 흐른 후에 물 묻혀서 롤링하면서 씻어냈는데 코가 진짜 맨질맨질해졌어요!! 이게 바하의 힘인가 싶기도 하고 ㅎㅎ 잘 사용할 수 있을 것 같습니다! 유분 많으신 지성분들에게 추천합니다~"
27897021,5,"2024.05.04","쑥떡팩폼 120ml+15ml 추가증정","A07","B03",0,true,false,"약산성클렌저가 마치 만능인것처럼 알려져있는데, 피지가 많이 분비되는 지성피부이거나 너무 예민한 상태가 아니라고 하면 오히려 저녁에는 약알리성세안제로 깨끗하게 씻어주는게 더 좋다고 해요. 한율  쑥떡팩폼은 쑥떡같은 쫀득한 제형이 풍성한 거품으로 변하면서 깨끗하게 세정이 되서 좋아요."
27891543,5,"2024.05.04","쑥떡팩폼 120ml+15ml 추가증정","A03","B02",1,true,false,"피지가 고민이라 구매하게 됐어요. 확실히 타 클렌징 폼에 비해 피지가 부드럽게 녹아 사라지는 기분이에요. 자극도 없어 순한 편이라 피지 제거에 잘 사용할 것 같아요! 자극이 심한 코팩을 안 써도 될 덧 같네요~ 어린쑥이라 그런가 피부가 더 좋아지는 기분입니다 ㅎㅎ"
27882568,5,"2024.05.04","쑥떡팩폼 120ml+15ml 추가증정","A02","B06",3,true,false,"최근에 한율에서 새로운 클렌징 제품이 나왔다길래 관심갖고 있었어요 팩도돼고 폼도된다니 너무 기대됐습니다. 사용해봤는데, 정말 만족스러웠어요. 이 제품은 100% 국내산 어린쑥으로 만들어졌다고 하더라고요. 그래서 그런지 쑥향도 진하게 나서 좋았어요 관리받는 느낌이랄까?  부드럽고 쫀득한 떡  질감이 인상 깊었어요. 피부에 부드럽게 발리면서도 노폐물과 피지를 꼼꼼히 제거해주더라고요. 세안 후에는 깨끗하고 촉촉한 피부 결을 느낄 수 있어요  흡착력이 너무 좋아서 건성분들은 조금 건조하다 느낄수있어요  팩하고 나서 보습꼼꼼하게 해주세요💚"
27796484,5,"2024.04.30","쑥떡팩폼 120ml+15ml 추가증정","A01","B02",8,true,false,"아주 신기한 정말 쑥떡같은 제형이라 신기해요 팩으로 사용하고 클렌징까지 한번에 해결할 수 있어 넘 편하고 좋네요!! 쑥떡 향기가 나서 힐링이 됩니다 ㅎㅎㅎ 클렌징이 자극적이지도 않고 순해서 더 좋은것같아요 아침세안시 더욱 좋습니다 피부가 당기지않아요~!"
27783430,5,"2024.04.30","쑥떡팩폼 120ml+15ml 추가증정","A02","B03",2,true,false,"• 한율 어린쑥 클렌징 흡착 팩폼  믿고 쓰는 한율에서 어린 쑥 팩폼이 나왔다고 해서 바로 구매해봤어요! 요즘 팩폼처럼 클렌징 폼도 되고 팩도 되는 제품이 많이 나오더라구요. 그래서 한 번씩 사용해봤어요.   제형은 엄청 꾸덕한 질감이었어요!  클렌징 폼으로 사용했을 때는 약알칼리성 클렌징이라서 뽀득하게 잘 씻겨나가구요. 그 대신 거품은 손으로만 비벼서 잘 나지는 않고 물을 많이 묻혀야 거품이 많이 나면서 씻어지더라구요.   팩으로는 위에 얹어뒀다가 금방 씻어줬는데 뭔가 안색이 맑아지는 느낌이었어요. 저는 클렌징보다는 팩으로 쓰는게 더 마음에 들더라구요."
27736672,5,"2024.04.28","쑥떡팩폼 120ml+15ml 추가증정","A03","B04",3,true,false,"신상이기도 하고, 흡착이라고 해서 세정력이 좋을 것 같아서 구매해봄. 제형은 굉장히 쫀독쫀독한 제형의 쑥색 제형이었음. 팩폼이라는 이름 답게 거품을 낸 후 팩처럼 얼굴에 올려두면 쫀득한 제형이 얼굴의 피지나, 이물질들을 흡착해서 깔끔하게 세정해 주는 원리인 것 같음!   또한 BHA성분도 들어가 있어서 각질을 녹여주기 때문에 지용성 피지인 블랙헤드와 각질이 조금씩 정리가 되어서 사용하고 나면 보들보들한 마무리감은 덤! BHA가 들어가 있기도 하고, 흡착 방식이 약간 피부에 자극이 될 것 같아 매일 사용은 어렵지만, 주기적으로 피부 결이 조금 거칠어졌다 느껴질 때 팩처럼 얹어주는 과정에서 팩, 클렌징을 모두 같이 할 수 있는 제품이라 간편하고 신기해서 마음에 듦!"
27701473,5,"2024.04.27","쑥떡팩폼 120ml+15ml 추가증정","","",1,true,false,"한율 어린쑥 라인 좋아하는데 신상 폼클렌징이 나와서 써봤어요 처음엔 쑥떡 느낌에서 롤링하면 쑥크림으로 변하고 또 물 묻히면 쫀득한 폼으로 3단 변화하는 폼클렌징이라 신기해요! 어린쑥 라인 향+쑥떡향 지대로 나서 세안하는 내내 입맛 다시게 되네요ㅋㅋㅎ 세정력이 좋아서 뽀득하게 마무리 되고 지성피부가 대만족할 것 같아요!"
27695122,5,"2024.04.26","쑥떡팩폼 120ml+15ml 추가증정","A03","B04",5,true,false,"약산성 제품은 지성인 저에게 선호되는 품목이 아니라 약알칼리성에 클렌징하는 재미가 있는 쑥떡폼을 샀어요!!! 촉촉 찰기있으면서 익숙한 쑥향이 올라오는개 기분좋았습니다😍 블랙헤드에도 효과가 있다고 하는데 좀 더 써보고 한달 후기에서 봐요"
27678695,5,"2024.04.26","쑥떡팩폼 120ml+15ml 추가증정","","",3,true,false,"진짜 쑥떡인줄~~ 짜는데 꾸우덕 하니 나오는데 쑥떡 뽑는 줄~ㅋ 신랑 면도 할때 쓰려고 구매했어요~ 면도하고 나면 트러블도 많이나고, 거품도 쫀쫀한 거품이 나야한데서..이리 저리 비교하다 딱 좋을것 같았어요~ 거품이 정말 딱 원했던 쫀쫀한 거품이나서 면도하기 너무 좋았다네요~ 진정효과가 있어서 그런지 트러블도 없이 좋다고 해요~ 정말 잘 산것 같아서 아주 만족입니다~^^"
27622946,5,"2024.04.23","쑥떡팩폼 120ml+15ml 추가증정","","B01",5,true,false,"믿고 쓰는 브랜드 한율! 이번엔 팩을 겸하는 클렌징 폼이 나왔네요, 너무 좋아하는 어린쑥 라인이라 좋아여 설명 그대로 쫀쫀한 텍스쳐라 피지가 쏙 빠지는 느낌이에요 잠깐 1분만 얼굴에 얹어놓고 머리감거나 몸 씻고 나서 세수하면 팩 효과 까지 굿이에요"
27620000,5,"2024.04.23","쑥떡팩폼 120ml+15ml 추가증정","","",1,true,false,"클렌징폼 정말 종류별로 써보면서 계속 저한테 맞는 클렌징폼을 찾고 있어요!! 특히 클렌징폼은 가족들이랑 같이 쓰다보니 모두가 만족하는 제품을 찾기가 쉽지 않더라고요ㅠㅠ 근데 최근에 한율 크림 제품 써보고 만족해서 이번에 클렌징폼 새롭게 나왔길래 한 번 구매해봤습니당!  제형은 쫀득한 느낌이고 발라놓고 몇 분있다가 씻어내는 식으로 세안하는데 일단 피부에 착 달라붙는 느낌이 너무 좋고 그래서 그런지 노폐물까지 씻어낼 것 같은 느낌이 들어 좋습니당~ 같이 쓰는 어머니도 만족하셨어요!!"
27599352,5,"2024.04.22","쑥떡팩폼 120ml+15ml 추가증정","A02","B01",21,true,false,"한율 쑥제품 러버입니다! 벌써 세번째인데요~ 당연히 이번제품도 좋을거라 생각하고 구매했는데 이게 무슨일!!! 너무좋자냐요 찰떡찰떡 피부에 착 달라붙어요ㅠㅠ팩으로도 사용할수 있어서 진짜 이게 제일 장점인듯 !!! 강추합니다 고민은 구매를 늦출 뿐입니다!!!♡♡♡"
28243789,5,"2024.05.18","쑥떡팩폼 120ml+15ml 추가증정","A06","B02",0,true,false,"원래 한율제품 좋아하는데 이번 클렌징도 냄새도 좋고 살짝 발라논 다음에 1분뒤에 미온수로 씻으니까 얼굴이 진짜 부드러워졌어요! 거품도 풍성하게 잘 납니다 !"
28174577,5,"2024.05.15","쑥떡팩폼 120ml+15ml 추가증정","A02","B02",4,true,false,"바를땐 팩하는 거 같은 질감인데 씻을때 폼클렌징처럼 거품도 나고 진짜 신기해요  뽀득뽀득해고 세정력이 아주 좋아요"
28149540,5,"2024.05.14","쑥떡팩폼 120ml+15ml 추가증정","A06","B06",3,true,false,"사용감이 진짜 좋네요 팩처럼 올렸다가 마사지 해주는 거까진 머드팩이랑 비슷한데 물로 씻어내면 폼클렌징처럼 부드럽고 거품 풍성해지면서 아주 잘 씻겨내려가요 굿"
27921275,5,"2024.05.05","쑥떡팩폼 120ml+15ml 추가증정","A03","B01",0,true,true,"약간 기름기 있을 때 사용하면 아주 말끔하게 세정되는 약알칼리 클렌징폼입니다!! 요즘 약산성들만 많아서 알칼리 찾고 있었는데 순하고 세정 잘 되고 너무 만족합니다"
27902815,5,"2024.05.05","쑥떡팩폼 120ml+15ml 추가증정","A03","B02",0,true,false,"팩도 할수있는 클렌져라 새롭네요 향은 한율수분크림향이 나요 떡같이 질퍽해서 신기해요 같이온 브러쉬도 예쁘고 잘쓸거같아요"
53759631,5,"2026.01.02","쑥떡팩폼120ml +미니 클렌징 3종","","",0,false,false,"진짜 쫀쫀하고 거품도 풍성해서 세안이 깔끔하게 되요 그리고  피지도 정리가 되더라구여 지성피부라서 뽀드득한 약알칼리성으로 세안하는데  이건 하고나면 피부가 당기지도 않고 맨들맨들촉촉하고 피부가 부드럽게 마무리되요!!!"
53748411,5,"2026.01.01","쑥떡팩폼120ml +미니 클렌징 3종","A03","B02",0,false,false,"한통 더 구매해보려고요~ 쓰기좋아요 효과도 있는거같아요"
53735070,5,"2026.01.01","쑥떡팩폼 120ml+15ml 추가증정","","",0,false,false,"추천받아서 사봤는데 팩이랑 폼이랑 같이 할 수 있어 좋아요~~"
53653520,5,"2025.12.30","쑥떡팩폼120ml +미니 클렌징 3종","A01","B01",0,false,false,"팩으로 사용하기도 좋고 그냥 클렌징폼으로 사용하기도 좋아요 블랙헤드도 드라마틱하게는 아니지만 잘 제거해주는것 같아서 다 쓰면 또 살거예요!!"
