reviewId,rating,date,option,skinType,skinTone,helpfulCount,hasPhoto,isRepurchase,content
53720474,5,"2026.01.01","쑥떡팩폼120ml +미니 클렌징 3종","A01","",0,false,false,"좋습니다, 약칼리 중에서도 자극이 상당히 없는 편에 속하고 세정력도 좋습니다.  저녁세안으로 주2~3회 정도 사용했는데 아주아주 만족했습니다!  거품도 잘 나고, 세정도 잘 되고, 자극도 적은 약알칼리 클렌징폼은 귀하죠 ㅎㅎ"
53703526,3,"2026.01.01","쑥떡팩폼 120ml+15ml 추가증정","","",0,false,false,"진짜 저는 믿었는데 자극이 너무 심하고 블랙헤드에 좋다고 했는데 효과가 아예 없는 거 같아요"
53684707,5,"2025.12.31","쑥떡팩폼 120ml+15ml 추가증정","","",0,false,false,"조아여조아여ㅡ 팩으로도 쓸 수 있고 세수용으로도 쓸 수 잇어서!"
53670415,5,"2025.12.31","쑥떡팩폼 120ml+15ml 추가증정","","",0,false,false,"약간 자극은 있지만 개기름 많이 나오는 날엔 이만한 게 없어요 ㅠㅠ"
53644873,5,"2025.12.30","쑥떡팩폼120ml +미니 클렌징 3종","","",0,false,false,"진짜 너무 좋아요 몇번 사용하니까 블랙헤드가 확실히 옅어졌어요 요철이나 블랙헤드가 고민이신분들 사용해 보세요!"
53524474,5,"2025.12.27","","","",0,false,false,"ㅎㅎ 쑥이 더 좋은 것 같지만 이것도 나름대로 잘 사용하고 있숩니당"
53523987,5,"2025.12.27","쑥떡팩폼120ml +미니 클렌징 3종","","",0,false,false,"진짜 피지 개많고 각질도 진짜 많은데 완전 뽀득뽀득해져서 좋아용"
53478581,5,"2025.12.26","쑥떡팩폼120ml +미니 클렌징 3종","A01","",0,false,false,"블랙헤드 없애는데에 효과 있다해서 구매해봤는데 아직 써본지 2주도 안돼서 효과는 잘 모르겠어여ㅕ 근데 그냥 무난무난하니 쓰기 좋은듯"
53430531,5,"2025.12.24","쑥떡팩폼120ml +미니 클렌징 3종","A04","B04",0,false,false,"가성비가 좋아서 집에소 편하기 쓰기 좋아요 추천합니다!!"
53426429,5,"2025.12.24","","A01","B04",0,false,false,"이거 향이 너무 좋아서 기분이 좋아요ㅠㅠ 그리고 세정력도 좋아서 요즘에 너무 잘 쓰고 있습니다ㅠㅠ"
53417599,4,"2025.12.24","쑥떡팩폼 120ml+15ml 추가증정","A02","B04",0,false,false,"처음에는 살짝 자극적으로 느껴졌는데 일주일에 한번 정도 쓰니까 괜찮네용 향도 좋고! 근데 재구매는 안할 것 같아요 순하지는 않아서 ㅠ"
53392055,5,"2025.12.23","","A04","",0,false,false,"관리하고 싶은날 사용해주고있어요! 팩폼인데 거품도 잘 나고 유자향도 제대로 나서 상큼하고 좋아요"
53387137,5,"2025.12.23","쑥떡팩폼 120ml+15ml 추가증정","A03","B03",0,false,false,"쫀쫀해서 노폐물이 빠져나가는 기분이랄까 그냥 무난하고 좋아요"
53373949,5,"2025.12.22","쑥떡팩폼 120ml+15ml 추가증정","A04","",0,false,false,"수부지 피부에 진짜 좋아요!!! 피부도 좋아지는 느낌이었어요!!! 한달 더 써보고 후기 남겨볼게용"
53321060,5,"2025.12.21","쑥떡팩폼 120ml+15ml 추가증정","A06","B02",0,false,false,"각질되는 느낌이라 좋아요!! 근데 매일 아침저녁으로 사용하면 좀 자극적일거같아서 일주일에 3번, 저녁에만 사용해주고 있어요!! 굿굿"
53320581,4,"2025.12.21","쑥떡팩폼 120ml+15ml 추가증정","A02","B02",0,false,false,"팩 용도로는 음….솔직히 피지 흡착 기능은 잘 모르겠어요 그냥 바하 클렌징폼으로 사용하기엔 괜찮은 것 같아여! 뽀득뽀득하게 잘 씻깁니당 매일 사용하기엔 조금 무리일 것 같구 2~3일 정도에 한번씩만 써주는게 좋을 것 같아요..!!"
53305433,3,"2025.12.20","쑥떡팩폼 120ml+15ml 추가증정","","",0,false,false,"여드름 따가워요!!!! 각질 없어지는 것도 ㅅ잘 모르겠어요"
53303432,5,"2025.12.20","쑥떡팩폼 120ml+15ml 추가증정","A02","B02",0,false,false,"쑥냄새나고 쫀득하고 좋아요!! 쑥냄새 싫어하는 분들은 싫어하실수도 있을거 같아요!! 클렌징후 쑥냄새 약간 나요ㅎ"
53241759,5,"2025.12.18","쑥떡팩폼 120ml+15ml 추가증정","A01","B05",0,false,false,"지성은 클렌징오일 쓰는거 안좋다해서 이제 화장은 요걸로 지우는데 말끔히 지워지구 가끔 팩으로 써도 피부 맨들맨질보들 해져서 조아요 쫀득해서 피지도 다 가져가는 느낌?!!!"
53215808,5,"2025.12.18","쑥떡팩폼 120ml+15ml 추가증정","A01","B05",0,false,false,"조금만 사용해도 거품 엄청 잘 나요 체고에요 향도 나쁘지 않아요"
53213580,5,"2025.12.18","쑥떡팩폼120ml +미니 클렌징 3종","A02","B04",0,false,false,"약알칼리성 클렌징폼 필요해서 구매했는데 향도 좋고 거품 잘 나고 세정도 잘 되어요 약산성 클렌저랑 번갈아가며 사용해주고 있습니당 쫀득쫀득해서 피지 흡착이 잘 될 거 같아요 ㅎㅎ 데일리로 각질케어하기도 좋은 제품 !!"
53197232,5,"2025.12.17","쑥떡팩폼120ml +미니 클렌징 3종","A03","B02",0,false,false,"세정력이 엄청 뛰어나고 촉촉하네요 근데 자극이 없다곤 할수 없으니 팩한 상태에서 롤링할때 너무 세게 하지마세요"
53186534,5,"2025.12.17"," ","A01","B03",0,false,false,"향기가 너무 너무 좋아요 유자차로 씻는거 같아요 다만 자극이 좀 강합니다"
53151120,5,"2025.12.16","쑥떡팩폼 120ml+15ml 추가증정","A02","B04",0,false,false,"건성이 쓰기에는 살짝 건조하긴 해요 대신 팩폼이라서 막 당길정도로 건조한건 아니에요"
53150387,5,"2025.12.16","쑥떡팩폼 120ml+15ml 추가증정","A01","B04",0,false,false,"피지 흡착 블랙헤드 없애려고 구매했어요! 좋습니닫ㅇ앙ㄴㅁ"
53148474,5,"2025.12.16","쑥떡팩폼120ml +미니 클렌징 3종","A01","B05",0,false,false,"궁금해서 눈여겨보고 있었는데 어워즈 기획 보고 못 참고 사버렸어요 생각보다 더 마음에 들어요! 순하고 씻고 나서도 건조하지 않아요 재구매의사 있어요~"
53146386,5,"2025.12.16","쑥떡팩폼 120ml+15ml 추가증정","A02","B01",0,false,false,"세정력도 좋고 눈시림 없어서 좋아요! 그리고 촉촉하게 세안되어서 좋아요"
53056594,5,"2025.12.14","쑥떡팩폼120ml +미니 클렌징 3종","A03","B04",0,false,false,"재구매 폼이에요 제형이 쫀쫀해서 피지 깨끗하게 정리됩니다"
53049898,5,"2025.12.14","쑥떡팩폼 120ml+15ml 추가증정","A06","B06",0,false,false,"뽀득하게 씻기는 클렌징폼 좋아하는데 세정력도 좋고 아주 대만족입니다"
53020270,5,"2025.12.13","쑥떡팩폼 120ml+15ml 추가증정","A02","B01",0,false,false,"정말 세안이 말끔하게 되는 기분. 겨울, 특히 건조한 피부에 매일 사용하기엔 어려움."
53013058,5,"2025.12.13","쑥떡팩폼120ml +미니 클렌징 3종","","",0,false,false,"피지 박멸 성공 그리고 씻을 때 뽀송뽀송한 느낌이 나서 기분이 좋이요"
52988647,5,"2025.12.12","쑥떡팩폼120ml +미니 클렌징 3종","A01","B05",0,false,false,"써보고 너무 좋아서 동생한테 추천한템인데 피부가 확달라지고 너무 좋아요"
52952843,5,"2025.12.11","쑥떡팩폼 120ml+15ml 추가증정","","",0,false,false,"두 번째 사용입니다!! 노폐물이나 화장도 자극 없이 잘 지워지고 팩폼과 같이 온 도구도 너무 좋아요!!"
52937131,5,"2025.12.11","쑥떡팩폼 120ml+15ml 추가증정","A02","B02",0,false,true,"가격읔 정말 착하진 않디만 제품자체는 좋은거같아요! 순하고 팩도 할수도 있고 일석이죠!"
52929472,5,"2025.12.11","쑥떡팩폼120ml +미니 클렌징 3종","A03","B01",0,false,false,"적응 양으로 자극없이 롤링이 잘 되고 각질 효과도 있어서 좋은 것 같습니다 ! 클렌징폼 치고는 가격이 있는 편이라 부담스러울수도 있찌만 거의 네번째 재구매라 제품력은 인정입니다. 겨울에는 유자폼도 좋은것 같아요 !"
52928451,4,"2025.12.11","쑥떡팩폼120ml +미니 클렌징 3종","A04","B06",0,false,false,"스크럽 알갱이가 있어서 자극감이 아예 없지 않지만 쑥향이 기분 좋고 피부 각질 제거하기 좋아요"
52875953,5,"2025.12.10","쑥떡팩폼 120ml+15ml 추가증정","A03","B03",0,false,false,"화장 지울 때 1,2차 세안 따로 하기는 귀찮거나 각질 제거 필요 할 때 사용해요"
52849460,5,"2025.12.09","쑥떡팩폼120ml +미니 클렌징 3종","A03","B05",0,false,false,"팩클랜저 처음 사용해보는데 다용도로 사용할 수 있어서  좋은 것 같아요"
52831534,5,"2025.12.09","쑥떡팩폼 120ml+15ml 추가증정","A04","B01",0,false,true,"팩으로도 폼클렌져로도 사용할 수 있어요 샤워하면서 팩으로 사용하다 씻어내면 좋아요"
52831388,5,"2025.12.09","쑥떡팩폼 120ml+15ml 추가증정","A04","B01",0,false,true,"팩으로도 폼클렌져로도 사용할 수 있어요 샤워하면서 팩으로 올려뒀다 씻어내면 좋아요"
52829846,5,"2025.12.09","쑥떡팩폼 120ml+15ml 추가증정","A03","B05",0,false,false,"다른 비싼 클렌징폼 쓰다가 다시 돌아서 여기로 왔어요 제일 순하고 저랑 잘 맞는 거 같아요 ㅎㅎ"
52812335,5,"2025.12.09","쑥떡팩폼 120ml+15ml 추가증정","A01","B01",0,false,false,"재구매해서 쓰는 제품입니다 데일리로 쓰고있고 다른 클폼 안쓰고있음"
52812320,5,"2025.12.09","쑥떡팩폼 120ml+15ml 추가증정","A01","B01",0,false,true,"저녁에 클렌징밀크로 일차세안하고 쑥떡팩폼으로 이차세안하면 딱 개운함"
52803884,5,"2025.12.09","쑥떡팩폼 120ml+15ml 추가증정","A03","B04",0,false,false,"팩폼 쫀쫌하고 진정과 피지 흡착에 좋아요!! 추천해여~~"
52790412,5,"2025.12.08","쑥떡팩폼 120ml+15ml 추가증정","A01","B01",0,false,false,"한율 모공팩 진짜 이거ㅜ가용해야함 팩하는데 쑥향때문에 스트레스 감소!!"
52750757,5,"2025.12.08","쑥떡팩폼 120ml+15ml 추가증정","","",0,false,true,"저번에사서써보고 피부가많이좋아지는것같아서 한번다시사서써봤어용ㅎㅎ"
52750433,5,"2025.12.08","쑥떡팩폼 120ml+15ml 추가증정","","",0,false,false,"쑥이트러블에좋은건알고있었는데 이거는진짜혁명수준이네요  정말좋아요"
52719810,5,"2025.12.07","쑥떡팩폼120ml +미니 클렌징 3종","A03","B06",0,false,false,"뽀득뽀득하게 씻겨서 마음에 들어요 ! 일주일에 두 번 정더 2차 세안제로 쓰고 있어요 ㅎㅎ"
52715533,5,"2025.12.07","쑥떡팩폼 120ml+15ml 추가증정","A03","B04",0,false,false,"메이크업 후 세안할때 쓰려고샀는데 확실히 세정력도좋고 피부가 보드라워지는거같아요! 이번 올영 빅세일때 하나 더 쟁였슴"
52692682,5,"2025.12.07","쑥떡팩폼120ml +미니 클렌징 3종","","",0,false,false,"팩으로 쓰고 폼으로 쓰고 활용도가 있어요 사실 팩으로서의 효과는 잘모르겠지만 무난해요"
52691947,5,"2025.12.07","쑥떡팩폼 120ml+15ml 추가증정","A02","B03",0,false,false,"쩐득쫀득 좋아요. 떡솝같은 기분이에요. 이번에 기획세트도 좋은듯요"
52626614,5,"2025.12.06","쑥떡팩폼120ml +미니 클렌징 3종","","",0,false,false,"좋아요 벌써 몇번째 재구ㅒ에여 올영세일때 사니까 싸게 살 구 있어요"
52494823,5,"2025.12.06","쑥떡팩폼 120ml+15ml 추가증정","A03","B02",0,false,false,"팩하기 귀찮을 때 좋아요. 한 30 초 올려놨다가 바로 폼 클레이처럼 비벼 버리는"
52450662,5,"2025.12.05","쑥떡팩폼120ml +미니 클렌징 3종","A02","B04",0,false,false,"아니 이거 왜 이제야 알았죠?? 각질제거 + 클렌징 기능까지 넘 좋습니다 !!"
52426303,5,"2025.12.05","쑥떡팩폼120ml +미니 클렌징 3종","","",0,false,false,"아렌시아 쓰는데 겨울되면 짜내는게 너무 힘들어서 이번엔 한율 한 번 구매해 봅니다 1달 후 후기로 돌아옴"
52420444,5,"2025.12.05","쑥떡팩폼 120ml+15ml 추가증정","A02","B01",0,false,true,"완전 쫀득하고 거품도 잘 나는데 건성한텐 너무 뽀득거려요. 같이 산 남자친구는 엄청 좋대요."
52399617,4,"2025.12.05","쑥떡팩폼 120ml+15ml 추가증정","A01","B04",0,false,false,"생각보다 세정력이 좋아서 놀랫어요 가볍게 화장햇으면 이거만 써도 충분함!"
52380788,5,"2025.12.04","쑥떡팩폼 120ml+15ml 추가증정","A03","B03",0,false,false,"건성이 쓰기에는 너무 강료크한 세정력이어따.. 많이 건조해져요"
52354329,5,"2025.12.04"," ","A03","B02",10,false,false,"우와 이 클렌징 폼 되게 좋아요. 향긋한 향이 클렌징할 때 기분 좋게 만들어줘요. 무엇보다, 피부가 깨끗해지고 톤 업 되어서 만족해요.ෆ˃̶͈̑.˂̶͈̑ෆ"
52345863,4,"2025.12.03","쑥떡팩폼 120ml+15ml 추가증정","A03","B04",0,false,false,"음...엄청나게 좋은지는 모르겠어요. 다만 사용감은 좋아서 잘 쓰는데 좀 비싼감..."
52322438,5,"2025.12.03","쑥떡팩폼 120ml+15ml 추가증정","A01","B06",0,false,true,"지성추천입니다!! 건성은 당길 수 있어요 제발 본인 피부타입에 맞는 걸 씁시다ㅜㅜ 건성인데 이런거 써서 건조하니 뭐니 그래서 평 안 좋게 남겨서 단종되게 하지 맙시다용....! 지성분들도 건성거 써서 넘 번들거린다구 하지 말기~"
52319788,3,"2025.12.03","쑥떡팩폼 120ml+15ml 추가증정","A03","B03",0,false,false,"세정력이 딱히 좋은지 모르겠어요 피부 수분 유분 다 씻기는 기분이라 재구매는 안할 것 같아요"
52292181,5,"2025.12.03","","A04","B03",0,false,false,"쑥라인 너무너무 잘 써서 잡티케어 좀 할겸 유자라인으로 사봤는데 향도 좋고 쑥라인보다 덜 꾸덕하지만 세정력은 비슷했어요."
52276983,5,"2025.12.02","쑥떡팩폼 120ml+15ml 추가증정","","",0,true,true,"쑥떡팩폼은 피지를 촘촘히 잡아주면서도 당김 없이 산뜻해 모공 케어용으로 좋아요"
52237708,5,"2025.12.02","쑥떡팩폼 120ml+15ml 추가증정","","",0,true,false,"한율 쑥 클렌저는 몇번째 재구매 중이예요. 세정력은 좋은데 자극이 없거든요."
51697037,5,"2025.11.22","","","",0,true,false,"딥클렌징을 하는데 속건조가 없는 매우 좋은 제품입니다. 세안할때 뽀득하게 하는걸 좋아하는데 그러면 피부가 당길때가 많은데 이건 피부 겉 기름은 닦아주면서 속은 촉촉해서 유자 다쓰면 쑥도 사볼 의향이 있어요"
51619271,5,"2025.11.20","쑥떡팩폼 120ml+15ml 추가증정","","",0,true,false,"거품도 잘나고 향도 좋아요.  물없이 팩으로 사용해도 좋은것 같습니다.  튜브에 비춰지는 내부용량이 잘 보여서 좋아요"
51445729,5,"2025.11.15"," ","","",0,true,false,"한율 유즈 수면팩이랑 또옥같은데 폼이에요 향도 너무 좋도 촉촉하게 세안 돼서 좋았어요 수면팩 원래 좋아해서 자주 쓰는데 쓰시던 분들은 이것도 쓰시면 만족하실 것 같아요 향이 좋고 질감도 좋아요"
51413322,3,"2025.11.15","쑥떡팩폼 120ml+15ml 추가증정","","",0,true,false,"두 번 쓰고 피부장벽 와르르 무너졌습니다 ㅋ쿠ㅜ 본품을 안뜯어서 다행이지 ㄷㄱ하렵니다 민감성, 홍조, 복합성, 속건조이신분들 참고하세요"
51322303,5,"2025.11.12","","","",0,true,false,"쫀득한 제형 냄새도 새콤한 유자냄새남 좋음 팩도 해보고싶은데 오늘은 폼만써봤다 잘 지워지고 비타민c 들어있어서 얼굴도 하얘지는기분"
51052791,5,"2025.11.06"," ","","",0,true,false,"완전 촉촛하고 순하고 세정력도 너무 좋어요! 향도 정말 좋고 피부가 좋아지는 느낌이 들어요 다쓰면 재구매 할 것 같아요 추천합니다!!"
44063047,3,"2025.06.15","쑥떡팩폼 120ml+15ml 추가증정","A01","B04",66,true,false,"제가 1월달에 구매하고 현재 5개월정도 되었는데 평소 보이지 않던 검은 무늬? 반점들이 생겼어요. 다른 클렌징관련 제품들은 이상이 없어서 보관방법에는 문제가 없는것 같은데(실온보관했습니다.) 갑자기 안보이던게 생겨서 혹시몰라서 폐기 했습니다. 처음사진은 구매 바로직후이고, 2,3번째 사진은 5개월이 지난 시점입니다."
53193692,4,"2025.12.17","쑥떡팩폼 120ml+15ml 추가증정","A04","B01",0,false,true,"매일 사용하기에는 자극있고 일주일에 2번정도 사용하면  순하고 자극없이  각질제거 되는 느낌이에요"
53186621,5,"2025.12.17","","","",0,false,false,"클렌징도 말끔하게 되는데 제일 좋은건 유자향이 솔솔나서 기분이 너무 젛아요"
53168198,5,"2025.12.16","","A03","B04",0,false,false,"너무좋아서 계속해서 재구매중이에요! 추천드립니다!!"
53152711,4,"2025.12.16","쑥떡팩폼 120ml+15ml 추가증정","A02","B01",0,false,false,"원래 쓰던 팩폼에서 갈아타보려고 산 템 중 하나인데 그냥 쏘쏘템.."
53149245,5,"2025.12.16","쑥떡팩폼 120ml+15ml 추가증정","A03","B04",0,false,false,"너무좋아서 계속해서 재구매중이에요! 추천드립니다!!"
53146489,5,"2025.12.16","쑥떡팩폼 120ml+15ml 추가증정","","",0,false,false,"역시 믿고 쓰는 한율입니다!ㅎㅎ 팩폼으로 사용하기 좋고 사용하고 나면 피부결 정리되고 세정력도 좋아요"
53133472,5,"2025.12.16","","","",0,false,false,"건성분들은 쑥덕보다는 유자가 덜 건조해요! 자극이 없어서 좋았어요."
53125564,5,"2025.12.15","쑥떡팩폼120ml +미니 클렌징 3종","A03","B02",0,false,false,"지성인 사람들이 여름+겨울 상관없이 잘 쓸것갘아용! 여행용으로도 들어잇어서조아용"
53116053,5,"2025.12.15","쑥떡팩폼120ml +미니 클렌징 3종","","",0,false,false,"클렌징폼 아무거나 쓰던 건성입니다… 한율 쑥떡팩폼 너무 유명해서 사볼까 하다가 가격 때문에 항상 못샀었는데 이번에 할인해서 사봤어요  비싸기도하고 그렇다고 뭐가 그렇게 다를까 의심했는데 솔직히 블랙헤드에 좋은지는 며칠 써본걸로 모르겠어요 근데 사용감이 너무 좋네요. 일단 제형이랑 향이 고급스러워서 맘에 들어요. 외출 후 이걸로 세안하면 하루를 잘 마무리하는듯한 느낌이 들어 좋습니다."
53114068,5,"2025.12.15","","A02","B06",0,false,false,"쑥떡을 잘 사용하고 있어서 유자가 궁금해서ㅠ왔어요 매일 쓰기보다는 뭔가 블랙헤드 관리하고 싶을때 팩처럼 사용중"
53101715,5,"2025.12.15","쑥떡팩폼 120ml+15ml 추가증정","A03","B02",0,false,false,"자극없이 순하고 거품도 잘나서 좋아요 샘플 먼저 사용중입니다 본품도 금방 써요"
53056066,5,"2025.12.14","쑥떡팩폼120ml +미니 클렌징 3종","","",0,false,false,"아모레퍼시픽 내 기초제품은 한율이랑 라네즈가 제일 좋은 것 같아요  이 클렌징 떡폼은 사실 그 같은 라인 쑥팩인 줄 알고 잘못사서 쓰게 된 건데.. 제 피부에 잘 맞더라고요 사실 지성피부라면 이 제품과 안 맞는 사람 찾기가 더 힘들 것 같아요 그러다보니 세 팩이나 썼어요   사계절을 다 써본 결과,  피지 과다 분비로 스트레스 받는 여름엔 아침 저녁 같은 라인의 팩과 함께 써주시면 좋고요 겨울엔 건조하기도 하고.. 피지가 여름만큼 분비되는 게 아니라 화장 지우고 2차 세안용으로 적합한 것 같아요 근데 전 그냥 아침 저녁 다 쓰고 운동한 뒤에 샤워할 때 또 쓰고 ㅋ 매일 썼어요 그래도 자극 없고 피지 잘 없애주고 좋았어요 작년에는 닥터지 필링젤로 이틀에 한 번 얼굴 밀어줬었는데 이 떡폼 쓰고 나니까 필링해도 때처럼 밀려나오는 각질이나 피지가 거의 0에 가까워졌다는...  좋은 점 1. 자극없는 피지 제거(저는 나비존이 특히 심한데 피지가 덜 분비되게 도와주진 않아요) 2. 자극없는 각질 제거(각질 쌓이는 속도는 확실히 늦어짐) 3. 세안 후 피부 당김이 다른 클렌저에 비해 확실히 적음. 그렇지만 세정력은 좋음  별로였던 점 엥간한 브랜드(올리브영이나 백화점 1층 브랜드는 다 써본 듯) 엥간한 제형(물에 풀어쓰는 고체, 분말, 젤 등등) 다 써봤는데 타 제품과 비교했을 때 딱히 어떤 부분에서도 별로인 점 없었음 제품만 두고 봐도 별로인 점은 없음   제가 건성은 아니라서 지성이나 지복합성이 쓰시면 꽤나 만족하실 듯 해요"
53043352,4,"2025.12.14","쑥떡팩폼 120ml+15ml 추가증정","A04","B01",0,false,false,"그냥 피부에 있는거 다가져가는템 가끔써요 완전 없애고 기초 바르고싶을때"
53039228,5,"2025.12.13","쑥떡팩폼120ml +미니 클렌징 3종","A03","B06",0,false,false,"친구추천으로 구매했어요. 무난하니 좋은 것 같아요 더 오래 사용해봐야 할 것 같아요"
52915547,5,"2025.12.11","쑥떡팩폼120ml +미니 클렌징 3종","","",0,false,false,"한 6번 산거 같아요 제가 피부자극이 예민해서 ㅠㅠ 여태 10개중 1개 뽑을 급으로 맞는 폼클렌징이 없었는데... 이건 맞아요!! ㅠㅠ"
52899052,3,"2025.12.10","쑥떡팩폼 120ml+15ml 추가증정","A06","B04",0,false,false,"민감성으로써 폼클렌징 용도로 써도 자극이 있음 피지 흡착도 잘 모르겠음.."
52885420,5,"2025.12.10","쑥떡팩폼120ml +미니 클렌징 3종","A03","B06",0,false,false,"대박 잘지워짐 .. 마무리감이 뽀독한걸 안좋아하시면 비추드립니다 이거 완전 뽀득하게 지워져요"
52868838,5,"2025.12.10","쑥떡팩폼 120ml+15ml 추가증정","A04","B03",0,false,true,"이거 진짜 개 좋아요. 뭔가 쓰면 부드럽고 세 정력도 좋고 그리고 여드름 나는 거 없이 편하게 쓰기 좋아요. 팩 으로 써도 되고 여러 가지가 다 좋은 제품."
52817401,5,"2025.12.09","쑥떡팩폼 120ml+15ml 추가증정","","",0,false,false,"평소에 개복치 피부라고 생각될정도로 예민한 편인데 이 제품은 피부에 반응도 없고 세정력도 좋아서 만족했어요 다만 가격이 조금 비싸다는 생각은 듭니다. 향도 좋고 뽀독뽀독 잘 닦여서 좋습니다. 피지제거에 크게 효능이 있는건 잘 모르겠어요."
52812664,5,"2025.12.09"," ","","",0,false,false,"한율 제품은 믿고 쓰는 편 ㅎㅎ 그만큼 너무 좋다는 뜻!!! 유자향더 개좋"
52702177,4,"2025.12.07","쑥떡팩폼 120ml+15ml 추가증정","A03","",0,false,false,"이래저래 만족하는제품이지만 다소 가격이 높은것같고 오백원동전만큼 짜서 팩하기에는 양도작고.."
52699561,5,"2025.12.07","쑥떡팩폼120ml +미니 클렌징 3종","","",0,false,false,"피부 수분감 하나더 안 뺏어가고 잘 씻김. 넘 쫀쫀한 제형이라 피부 자극갈까봐 걱정했는데 파워지성의 두꺼운 피부엔 전혀 자극 없았음. 한방쑥 아니구 걍 쑥향이라 젛음 은은함. 세정력도 좋음. 다만 눈화장은 핑거브러쉬로 문질러줘야 완전히 닦임. 아님 리무버나 클렌징워터로 눈만 닦고 씻던가. 씻구니오면 뽀득도 아니고 미끄덩도 아니고 걍 딱 좋음 재구매했슨!!! 그리고 블랙헤드도 제법 없어진듯? 전에 샘플로 같이온 쑥머드팩밤인가 그건 나한테 정말 별로여ㅆ음 세정력도 없고 미끈 거리고 근데 쑥떡팩폼은 진짜 잘 맞음  아 근데 일반 폼클보다 양을 많리 쓰게 되어서 빨리 닳음."
52699240,5,"2025.12.07","","","",0,false,false,"피부 수분감 하나더 안 뺏어가고 잘 씻김. 넘 쫀쫀한 제형이라 피부 자극갈까봐 걱정했는데 파워지성의 두꺼운 피부엔 전혀 자극 없았음. 한방쑥 아니구 걍 쑥향이라 젛음 은은함. 세정력도 좋음. 다만 눈화장은 핑거브러쉬로 문질러줘야 완전히 닦임. 아님 리무버나 클렌징워터로 눈만 닦고 씻던가. 씻구니오면 뽀득도 아니고 미끄덩도 아니고 걍 딱 좋음 재구매했슨!!!"
52680962,5,"2025.12.06","쑥떡팩폼 120ml+15ml 추가증정","A01","",0,false,true,"데일리로 쓰기에는 자극이 있을 수 있는데 일주일에 2~3회 정도 쓰면 딱 좋음 이번이 2번째 구매인데 다 쓰면 다시 구매예정입니더"
52649757,5,"2025.12.06","쑥떡팩폼 120ml+15ml 추가증정","","",0,false,false,"어쩌다가 친구꺼 잔깐 사용하게 되었는데 와.. 한번 저녁에 세정하고 아침에 봤는데 좁쌀?이 뭘 해도 안사라지다가 갑자기 눈에 띄게 잘 안보이는거에요 개깜놀  그래서 이번에 쟁겼어요^_^ 너어무 좋아요 조금 건조하긴 한데 뭐 그정도는^^"
52647773,5,"2025.12.06","쑥떡팩폼120ml +미니 클렌징 3종","A02","B04",1,false,false,"연말결산 특가라 싸게 샀어요 모공세척하기에 좋고 자극도 별로 안심해요"
52515790,4,"2025.12.06","쑥떡팩폼 120ml+15ml 추가증정","A03","B03",0,false,false,"상처잇을때 쓰면 좀 아프긴해요 쑥향이 좋아요 얼굴이 뽀독뽀독해져요 재구매한 제품"
52417829,5,"2025.12.05","쑥떡팩폼 120ml+15ml 추가증정","A03","B06",0,false,true,"진짜 재재구매중잊니다  각질제거템이라 데일리로 쓰면 너무 자극 갈까 생각했는데 전혀아님"
