reviewer,rating,date,content,skinType,helpfulCount
"익명",4,"2025.12.22","메노킨 가쉬 스킨으로 사용중 한달후기. 가쉬보다  메노킨을 더 잘 씀 메노킨은  수분이 충족되는 스킨 (리프트- 모이스트 순으로  좋음,리페어는 재구매안할템) 가쉬는  메노킨에 비해 수분충족은 덜하나 쫀쫀한 느낌에 광이 남 20대는 가쉬만 사용해도 만족스러울텐데 30대부터 수분이 더  충족되어야 함 가쉬 단독 사용 만족스럽지 않아서 에스트라 아토베리어로션과 궁합이 좋았음","A02",5
"익명",5,"2025.12.30","바르자마자 미세한 버블이 올라오면서  피부를 부드럽게 감싸주고, 10초 정도면 충분해서 세안 전후 어디에나 활용하기 편했어요. 사용 후에는 피부가 한결 쫀쫀해지고 탄력이 살아난 느낌이라  만족스러웠고, 당김 없이 촉촉하게 마무리돼요. 자극적이지 않아서 데일리로 쓰기 좋고, 여러 번 나눠 쓸 수 있는 대용량 구성이라 가성비도 괜찮았어요. 간편하게 탄력 관리하고 싶은 분들께 추천하고 싶어요.","A02",4
"익명",5,"2025.12.21","모든 기초제품류중에 수분라인은 기본템이라 지나칠수없죠 데일리로 제일 무난하게 사용가능할 것 같아요","A03",4